<!ELEMENT productos (producto+)>
<!ELEMENT producto (nombre,descripcion,precio,categoria,stock)>
<!ATTLIST producto id NMTOKEN #REQUIRED>
<!ELEMENT nombre (#PCDATA)>
<!ELEMENT descripcion (#PCDATA)>
<!ELEMENT precio (#PCDATA)>
<!ELEMENT categoria (#PCDATA)>
<!ELEMENT stock (#PCDATA)>